{
  "version": 1,
  "source": {
    "path": "lib_data/design-resource-library-295.csv",
    "sha256": "93481fcc50205062fc41b6bb8f3e971f8a89df86ba5504bccc652f8adfb233ff",
    "rowCount": 295
  },
  "resources": [
    {
      "id": "resource-72db4d1ca982",
      "slug": "designindex",
      "name": "DesignIndex",
      "url": "https://www.designindex.xyz",
      "domain": "designindex.xyz",
      "description": "Curated directory of design inspiration and useful design resources",
      "category": "website-inspiration",
      "access": "free",
      "subscriptionRequired": "no",
      "usefulFor": [],
      "tags": [],
      "status": "active"
    },
    {
      "id": "resource-3ea619b0ed5d",
      "slug": "toools-design",
      "name": "TOOOLS.design",
      "url": "https://www.toools.design",
      "domain": "toools.design",
      "description": "Large searchable directory of design tools, assets, inspiration, and learning resources",
      "category": "website-inspiration",
      "access": "free",
      "subscriptionRequired": "no",
      "usefulFor": [],
      "tags": [],
      "status": "active",
      "previewImageUrl": "https://cdn.prod.website-files.com/5ce10a4c0b5f0b05f522e746/6a4a19c7af17b15abe7f8a0a_toools-design-ogimg.jpg",
      "previewSource": "open-graph",
      "faviconUrl": "https://cdn.prod.website-files.com/5ce10a4c0b5f0b05f522e746/6a04fc6e5e84a0009e4f999f_toools-design-favicon-light.png"
    },
    {
      "id": "resource-602441c6550b",
      "slug": "land-book",
      "name": "Land-book",
      "url": "https://land-book.com",
      "domain": "land-book.com",
      "description": "Curated landing-page and website inspiration",
      "category": "website-inspiration",
      "access": "freemium",
      "subscriptionRequired": "optional",
      "usefulFor": [],
      "tags": [],
      "status": "active"
    },
    {
      "id": "resource-4798232a04e5",
      "slug": "one-page-love",
      "name": "One Page Love",
      "url": "https://onepagelove.com",
      "domain": "onepagelove.com",
      "description": "One-page website inspiration, templates, and examples",
      "category": "website-inspiration",
      "access": "free",
      "subscriptionRequired": "no",
      "usefulFor": [],
      "tags": [],
      "status": "active",
      "previewImageUrl": "https://assets.onepagelove.com/cdn-cgi/image/width=1200,height=628,fit=cover,gravity=top,format=jpg,quality=85/wp-content/uploads/global/one-page-love-meta.jpg",
      "previewSource": "open-graph",
      "faviconUrl": "https://onepagelove.com/wp-content/themes/onepagelove/frontend/img/favicon/favicon-32x32.png"
    },
    {
      "id": "resource-2bd75e3b5922",
      "slug": "awwwards",
      "name": "Awwwards",
      "url": "https://www.awwwards.com",
      "domain": "awwwards.com",
      "description": "Award-winning websites, experimental interactions, and agency work",
      "category": "website-inspiration",
      "access": "free",
      "subscriptionRequired": "no",
      "usefulFor": [],
      "tags": [],
      "status": "active",
      "previewImageUrl": "https://assets.awwwards.com/assets/images/pages/about-certificates/awwwards.jpg",
      "previewSource": "open-graph"
    },
    {
      "id": "resource-a5297d09a82a",
      "slug": "siteinspire",
      "name": "SiteInspire",
      "url": "https://www.siteinspire.com",
      "domain": "siteinspire.com",
      "description": "Curated gallery of strong web and interactive design",
      "category": "website-inspiration",
      "access": "free",
      "subscriptionRequired": "no",
      "usefulFor": [],
      "tags": [],
      "status": "active"
    },
    {
      "id": "resource-169e5a48b03e",
      "slug": "godly",
      "name": "Godly",
      "url": "https://godly.website",
      "domain": "godly.website",
      "description": "Modern and highly polished website inspiration",
      "category": "website-inspiration",
      "access": "free",
      "subscriptionRequired": "no",
      "usefulFor": [],
      "tags": [],
      "status": "active"
    },
    {
      "id": "resource-db60acdf7cd7",
      "slug": "lapa-ninja",
      "name": "Lapa Ninja",
      "url": "https://www.lapa.ninja",
      "domain": "lapa.ninja",
      "description": "Landing-page inspiration organized by industry and section",
      "category": "website-inspiration",
      "access": "free",
      "subscriptionRequired": "no",
      "usefulFor": [],
      "tags": [],
      "status": "active"
    },
    {
      "id": "resource-74ccbd68a672",
      "slug": "httpster",
      "name": "Httpster",
      "url": "https://httpster.net",
      "domain": "httpster.net",
      "description": "Curated creative and minimal website showcase",
      "category": "website-inspiration",
      "access": "free",
      "subscriptionRequired": "no",
      "usefulFor": [],
      "tags": [],
      "status": "active"
    },
    {
      "id": "resource-def4db859619",
      "slug": "the-fwa",
      "name": "The FWA",
      "url": "https://thefwa.com",
      "domain": "thefwa.com",
      "description": "Experimental, interactive, and cutting-edge digital experiences",
      "category": "website-inspiration",
      "access": "free",
      "subscriptionRequired": "no",
      "usefulFor": [],
      "tags": [],
      "status": "active",
      "faviconUrl": "https://thefwa.com/favicons/apple-touch-icon-180x180.png"
    },
    {
      "id": "resource-b3453071dc4e",
      "slug": "css-design-awards",
      "name": "CSS Design Awards",
      "url": "https://www.cssdesignawards.com",
      "domain": "cssdesignawards.com",
      "description": "Award gallery for web design, UI, UX, and innovation",
      "category": "website-inspiration",
      "access": "free",
      "subscriptionRequired": "no",
      "usefulFor": [],
      "tags": [],
      "status": "active"
    },
    {
      "id": "resource-c5b1425b1432",
      "slug": "css-nectar",
      "name": "CSS Nectar",
      "url": "https://cssnectar.com",
      "domain": "cssnectar.com",
      "description": "Curated website inspiration and design awards",
      "category": "website-inspiration",
      "access": "free",
      "subscriptionRequired": "no",
      "usefulFor": [],
      "tags": [],
      "status": "active"
    },
    {
      "id": "resource-a7ae7a615066",
      "slug": "best-website-gallery",
      "name": "Best Website Gallery",
      "url": "https://bestwebsite.gallery",
      "domain": "bestwebsite.gallery",
      "description": "Hand-picked website design gallery",
      "category": "website-inspiration",
      "access": "free",
      "subscriptionRequired": "no",
      "usefulFor": [],
      "tags": [],
      "status": "active",
      "faviconUrl": "https://bestwebsite.gallery/assets/images/bitmap/favicon/apple-touch-icon-152x152.png"
    },
    {
      "id": "resource-9a7fe5ea46f5",
      "slug": "minimal-gallery",
      "name": "Minimal Gallery",
      "url": "https://minimal.gallery",
      "domain": "minimal.gallery",
      "description": "Clean, minimal, and functional website inspiration",
      "category": "website-inspiration",
      "access": "free",
      "subscriptionRequired": "no",
      "usefulFor": [],
      "tags": [],
      "status": "active",
      "previewImageUrl": "https://minimal.gallery/wp-content/themes/minimalgallery/assets/img/meta/og.jpg",
      "previewSource": "open-graph",
      "faviconUrl": "https://minimal.gallery/wp-content/themes/minimalgallery/assets/favicon/apple-touch-icon.png"
    },
    {
      "id": "resource-f2e570494baf",
      "slug": "siiimple",
      "name": "Siiimple",
      "url": "https://siiimple.com",
      "domain": "siiimple.com",
      "description": "Minimal website gallery",
      "category": "website-inspiration",
      "access": "free",
      "subscriptionRequired": "no",
      "usefulFor": [],
      "tags": [],
      "status": "active",
      "faviconUrl": "https://siiimple.com/wp-content/uploads/2018/02/cropped-favicon-1-1-180x180.png"
    },
    {
      "id": "resource-16efe83c69aa",
      "slug": "sitesee",
      "name": "SiteSee",
      "url": "https://sitesee.co",
      "domain": "sitesee.co",
      "description": "Modern website inspiration gallery",
      "category": "website-inspiration",
      "access": "free",
      "subscriptionRequired": "no",
      "usefulFor": [],
      "tags": [],
      "status": "active",
      "previewImageUrl": "https://d3alngem7je9z2.cloudfront.net/sitesee_banner.png",
      "previewSource": "open-graph",
      "faviconUrl": "https://sitesee.co/apple-touch-icon.png"
    },
    {
      "id": "resource-154e355b6bfc",
      "slug": "hoverstat-es",
      "name": "Hoverstat.es",
      "url": "https://www.hoverstat.es",
      "domain": "hoverstat.es",
      "description": "Alternative, experimental, and unconventional web design",
      "category": "website-inspiration",
      "access": "free",
      "subscriptionRequired": "no",
      "usefulFor": [],
      "tags": [],
      "status": "active"
    },
    {
      "id": "resource-859433d5d4ec",
      "slug": "landing-love",
      "name": "Landing Love",
      "url": "https://www.landing.love",
      "domain": "landing.love",
      "description": "Animated landing pages and interaction inspiration",
      "category": "website-inspiration",
      "access": "free",
      "subscriptionRequired": "no",
      "usefulFor": [],
      "tags": [],
      "status": "active",
      "previewImageUrl": "https://www.landing.love/img/social.jpg",
      "previewSource": "open-graph",
      "faviconUrl": "https://www.landing.love/img/favicon.png"
    },
    {
      "id": "resource-8934e2f80a0c",
      "slug": "maxibestof",
      "name": "MaxiBestOf",
      "url": "https://maxibestof.one",
      "domain": "maxibestof.one",
      "description": "Websites, typography, and visual inspiration",
      "category": "website-inspiration",
      "access": "free",
      "subscriptionRequired": "no",
      "usefulFor": [],
      "tags": [],
      "status": "active"
    },
    {